{
  "schema_version": "1.2.0",
  "snapshot_date": "2026-09-28",
  "captured_at": "2026-09-27T16:02:08Z",
  "timezone": "Asia/Shanghai",
  "capture_quality": {
    "local_captured_at": "2026-09-28T00:02:08+08:00",
    "scheduled_offset_minutes": -18,
    "valid_for_ranking": true,
    "reason": "within_window"
  },
  "candidate_count": 2000,
  "collection": {
    "search_result_counts": {
      "recent_created": 1000,
      "recent_active": 500,
      "established_active": 500
    },
    "unique_discovered_count": 1927,
    "candidate_added_count": 2,
    "candidate_removed_count": 0,
    "api_request_count": 1322,
    "api_retry_count": 0,
    "snapshot_expected_count": 2000,
    "snapshot_complete_count": 2000,
    "snapshot_completeness": 1.0
  },
  "repositories": {
    "1196232857": {
      "stars_total": 297,
      "full_name": "0sec-labs/foxguard"
    },
    "28751632": {
      "stars_total": 33593,
      "full_name": "0xAX/linux-insides"
    },
    "1347713438": {
      "stars_total": 124,
      "full_name": "0xBakeer/qwen38-flash-next-spark"
    },
    "393734131": {
      "stars_total": 684,
      "full_name": "0xDanielLopez/TweetFeed"
    },
    "104337773": {
      "stars_total": 61557,
      "full_name": "1c7/chinese-independent-developer"
    },
    "691347156": {
      "stars_total": 22879,
      "full_name": "1Panel-dev/MaxKB"
    },
    "1353845349": {
      "stars_total": 157,
      "full_name": "2600th/dlss5-video-player"
    },
    "256559677": {
      "stars_total": 326,
      "full_name": "2anki/2anki.net"
    },
    "186733095": {
      "stars_total": 63190,
      "full_name": "2dust/v2rayNG"
    },
    "1357948479": {
      "stars_total": 369,
      "full_name": "34306/vphone-web"
    },
    "1239699520": {
      "stars_total": 274,
      "full_name": "410979729/scope-recall-hermes"
    },
    "262932920": {
      "stars_total": 10859,
      "full_name": "47ng/nuqs"
    },
    "21331090": {
      "stars_total": 26922,
      "full_name": "4ian/GDevelop"
    },
    "263556058": {
      "stars_total": 29870,
      "full_name": "521xueweihan/GitHub520"
    },
    "76232302": {
      "stars_total": 638,
      "full_name": "5e-bits/5e-srd-api"
    },
    "850267588": {
      "stars_total": 30244,
      "full_name": "78/xiaozhi-esp32"
    },
    "1351310492": {
      "stars_total": 157,
      "full_name": "a1exsun/dsh-council"
    },
    "1063641074": {
      "stars_total": 16526,
      "full_name": "a2ui-project/a2ui"
    },
    "1346328866": {
      "stars_total": 255,
      "full_name": "Aadiii00/SIH-Winners-PPt-and-Sources"
    },
    "846698999": {
      "stars_total": 54705,
      "full_name": "aaif-goose/goose"
    },
    "1357036560": {
      "stars_total": 132,
      "full_name": "aaravshah1311/Agent-2"
    },
    "1351748923": {
      "stars_total": 159,
      "full_name": "aardappel/goose"
    },
    "10671623": {
      "stars_total": 3142,
      "full_name": "aardappel/treesheets"
    },
    "1107964800": {
      "stars_total": 323,
      "full_name": "aaryansamanta/aaryansamanta.github.io"
    },
    "402762873": {
      "stars_total": 3940,
      "full_name": "abcz316/SKRoot-linuxKernelRoot"
    },
    "1031059905": {
      "stars_total": 47614,
      "full_name": "abhigyanpatwari/GitNexus"
    },
    "1284153858": {
      "stars_total": 7589,
      "full_name": "abue-ammar/tinycast"
    },
    "379327986": {
      "stars_total": 1532,
      "full_name": "AccessKit/accesskit"
    },
    "1355792562": {
      "stars_total": 185,
      "full_name": "ACECang/JDSystem"
    },
    "763622789": {
      "stars_total": 397,
      "full_name": "AceDataCloud/Nexior"
    },
    "572922963": {
      "stars_total": 2979,
      "full_name": "acepanel/panel"
    },
    "573661753": {
      "stars_total": 24750,
      "full_name": "activepieces/activepieces"
    },
    "105379569": {
      "stars_total": 24845,
      "full_name": "actix/actix-web"
    },
    "486815039": {
      "stars_total": 29176,
      "full_name": "actualbudget/actual"
    },
    "1022611643": {
      "stars_total": 250,
      "full_name": "adcontextprotocol/adcp"
    },
    "62712899": {
      "stars_total": 37081,
      "full_name": "AdguardTeam/AdGuardHome"
    },
    "1355304204": {
      "stars_total": 285,
      "full_name": "Adkid-Zephyr/oral-paper-skill"
    },
    "1371405654": {
      "stars_total": 299,
      "full_name": "adonis-singh/re4"
    },
    "1345267734": {
      "stars_total": 206,
      "full_name": "ADScanPro/Claude-AD"
    },
    "1354611198": {
      "stars_total": 1318,
      "full_name": "adtexterry-lgtm/unigit-ecosystem"
    },
    "1201294899": {
      "stars_total": 137,
      "full_name": "AetherKiri/AetherKiri"
    },
    "1180091786": {
      "stars_total": 228,
      "full_name": "aethersdr/AetherSDR"
    },
    "6915703": {
      "stars_total": 1591,
      "full_name": "af/envalid"
    },
    "1136590548": {
      "stars_total": 268210,
      "full_name": "affaan-m/ECC"
    },
    "979392131": {
      "stars_total": 16069,
      "full_name": "ag-ui-protocol/ag-ui"
    },
    "162279822": {
      "stars_total": 55915,
      "full_name": "agalwood/Motrix"
    },
    "1131238324": {
      "stars_total": 3293,
      "full_name": "agent-of-empires/agent-of-empires"
    },
    "812975380": {
      "stars_total": 19308,
      "full_name": "agent0ai/agent-zero"
    },
    "1007251296": {
      "stars_total": 4335,
      "full_name": "agentclientprotocol/agent-client-protocol"
    },
    "1179222510": {
      "stars_total": 635,
      "full_name": "AgentiLoop/Agent"
    },
    "1364134430": {
      "stars_total": 327,
      "full_name": "agents-universe/agents-universe"
    },
    "1165324947": {
      "stars_total": 35300,
      "full_name": "agentscope-ai/QwenPaw"
    },
    "1356717536": {
      "stars_total": 161,
      "full_name": "agfnow/agentflow"
    },
    "488641606": {
      "stars_total": 42354,
      "full_name": "agno-agi/agno"
    },
    "607845880": {
      "stars_total": 2431,
      "full_name": "AI-Hypercomputer/maxtext"
    },
    "1358948316": {
      "stars_total": 640,
      "full_name": "aimeoa/hanshuang-codex"
    },
    "1347015929": {
      "stars_total": 155,
      "full_name": "aiming-lab/RSI-Exam"
    },
    "51206425": {
      "stars_total": 494,
      "full_name": "aio-libs/multidict"
    },
    "283046497": {
      "stars_total": 22140,
      "full_name": "airbytehq/airbyte"
    },
    "107093851": {
      "stars_total": 422,
      "full_name": "AiursoftWeb/Kahla"
    },
    "212037775": {
      "stars_total": 22766,
      "full_name": "akfamily/akshare"
    },
    "514062293": {
      "stars_total": 3687,
      "full_name": "akuity/kargo"
    },
    "1358009970": {
      "stars_total": 191,
      "full_name": "AlayaLab/PWM"
    },
    "1354411229": {
      "stars_total": 319,
      "full_name": "AlayaLab/WorldSculpt"
    },
    "1349990522": {
      "stars_total": 159,
      "full_name": "aleksandr-alhoff/seo-landing"
    },
    "1351890013": {
      "stars_total": 187,
      "full_name": "AlephAITech/DoubaoWorkGuide"
    },
    "1369125448": {
      "stars_total": 142,
      "full_name": "alex-holovach/life"
    },
    "1351122837": {
      "stars_total": 207,
      "full_name": "AlexTam930/crossPlatformAi"
    },
    "1345289911": {
      "stars_total": 325,
      "full_name": "Alexwtlf/agentic-product-demo"
    },
    "146633589": {
      "stars_total": 37558,
      "full_name": "alibaba/arthas"
    },
    "1150302188": {
      "stars_total": 1309,
      "full_name": "alibaba/lumenx"
    },
    "181436799": {
      "stars_total": 16148,
      "full_name": "alibaba/MNN"
    },
    "112785414": {
      "stars_total": 29179,
      "full_name": "alibaba/spring-cloud-alibaba"
    },
    "1372400287": {
      "stars_total": 181,
      "full_name": "alicasuu/llmwiki-operational"
    },
    "1144520675": {
      "stars_total": 56033,
      "full_name": "Alishahryar1/free-claude-code"
    },
    "877403993": {
      "stars_total": 529,
      "full_name": "allenhutchison/obsidian-gemini"
    },
    "1351039692": {
      "stars_total": 223,
      "full_name": "AlLHHH/ALH-Pro"
    },
    "60024365": {
      "stars_total": 16207,
      "full_name": "alshedivat/al-folio"
    },
    "1119829225": {
      "stars_total": 2898,
      "full_name": "Alvin9999-newpac/fanqiang"
    },
    "1359081910": {
      "stars_total": 160,
      "full_name": "alvinunreal/awesome-submitlist"
    },
    "17883395": {
      "stars_total": 2578,
      "full_name": "amadvance/snapraid"
    },
    "87705200": {
      "stars_total": 5102,
      "full_name": "amanusk/s-tui"
    },
    "1353069894": {
      "stars_total": 310,
      "full_name": "AMAP-ML/DreamX-Creator"
    },
    "1351919577": {
      "stars_total": 146,
      "full_name": "AMAP-ML/LoopArena"
    },
    "1269124956": {
      "stars_total": 2218,
      "full_name": "amElnagdy/delegate-skills"
    },
    "1357299429": {
      "stars_total": 144,
      "full_name": "amirmushichge/video-states-website"
    },
    "1288835164": {
      "stars_total": 1635,
      "full_name": "ammaarreshi/Generals-Mac-iOS-iPad"
    },
    "1278926400": {
      "stars_total": 1378,
      "full_name": "amplifthq/opentag"
    },
    "89738953": {
      "stars_total": 810,
      "full_name": "AMReX-Codes/amrex"
    },
    "838849799": {
      "stars_total": 4660,
      "full_name": "amzxyz/rime-wanxiang"
    },
    "267054247": {
      "stars_total": 12936,
      "full_name": "anchore/grype"
    },
    "1359081044": {
      "stars_total": 198,
      "full_name": "Andonywang123/Epost"
    },
    "934715082": {
      "stars_total": 2161,
      "full_name": "andremichelle/openDAW"
    },
    "1360860817": {
      "stars_total": 149,
      "full_name": "andrewroxby/claude-style-patch"
    },
    "24195339": {
      "stars_total": 101033,
      "full_name": "angular/angular"
    },
    "1351222102": {
      "stars_total": 141,